<?xml version="1.0" encoding="ISO-8859-1"?>
<informeVentasAutomoviles xmlns:xsi="http://www.w3.org/2001/XMLSchema-instance" 
xsi:noNamespaceSchemaLocation="editorial.xsd">
    <informeRegionalAutomoviles fecha="2024-02-01">
        <Descripcion>Reporte de ventas de automóviles por región y temporada</Descripcion>
        <Ubicacion>
            <EstadosUnidos>
                <Periodos>
                    <Primavera>
                        <automovilesVendidos>100</automovilesVendidos>
                    </Primavera>
                    <Verano>
                        <automovilesVendidos>250</automovilesVendidos>
                    </Verano>
                    <Otoño>
                        <automovilesVendidos>698</automovilesVendidos>
                    </Otoño>
                    <Invierno>
                        <automovilesVendidos>255</automovilesVendidos>
                    </Invierno>
                </Periodos>        
            </EstadosUnidos>
            <Canada>
                <Periodos>
                    <Primavera>
                        <automovilesVendidos>300</automovilesVendidos>
                    </Primavera>
                    <Verano>
                        <automovilesVendidos>100</automovilesVendidos>
                    </Verano>
                    <Otoño>
                        <automovilesVendidos>160</automovilesVendidos>
                    </Otoño>
                    <Invierno>
                        <automovilesVendidos>270</automovilesVendidos>
                    </Invierno>
                </Periodos>
            </Canada>
            <Mexico>
                <Periodos>
                    <Primavera>
                        <automovilesVendidos>500</automovilesVendidos>
                    </Primavera>
                    <Verano>
                        <automovilesVendidos>100</automovilesVendidos>
                    </Verano>
                    <Otoño>
                        <automovilesVendidos>150</automovilesVendidos>
                    </Otoño>
                    <Invierno>
                        <automovilesVendidos>100</automovilesVendidos>
                    </Invierno>
                </Periodos>
            </Mexico>
        </Ubicacion>
    </informeRegionalAutomoviles>
</informeVentasAutomoviles>
